{
  "version": 1,
  "name": "unknown-directive",
  "lineEnding": "lf",
  "trailingNewline": false,
  "bom": false,
  "defines": [],
  "sourceLines": [
    "#define LOCAL",
    "const value = 1;"
  ],
  "lineStates": [
    "directive",
    "active"
  ],
  "directives": [],
  "diagnostics": [
    {
      "code": "unknown-directive",
      "start": {
        "line": 0,
        "character": 0
      },
      "end": {
        "line": 0,
        "character": 7
      }
    }
  ]
}
